class	slot	abstract	alias	aliases	annotation_expected_value	annotation_occurrence	annotation_preferred_unit	annotation_tooltip	any_of	broad_mappings	close_mappings	comments	contributors	description	designates_type	exact_mappings	example_values	id_prefixes	identifier	inlined	inlined_as_list	is_a	list_elements_ordered	mappings	maximum_cardinality	maximum_value	minimum_cardinality	minimum_value	mixins	multivalued	narrow_mappings	notes	pattern	range	rank	recommended	required	see_also	slot_group	slot_uri	string_serialization	structured_aliases	structured_pattern.syntax	title	todos
AttributeValue	has_raw_value													"The value that was specified for an annotation in raw form, i.e. a string. E.g. ""2 cm"" or ""2-4 cm"""																				string											
AttributeValue	type													the class_uri of the class that has been instantiated	True		nmdc:Biosample|nmdc:Study															replaces legacy nmdc:type slot|makes it easier to read example data files|required for polymorphic MongoDB collections		uriorcurie			True	https://github.com/microbiomedata/nmdc-schema/issues/1048|https://github.com/microbiomedata/nmdc-schema/issues/1233|https://github.com/microbiomedata/nmdc-schema/issues/248		rdf:type		"JsonObj(workflow_execution_class=StructuredAlias({
  'literal_form': 'workflow_execution_class',
  'predicate': AliasPredicateEnum(text='NARROW_SYNONYM', meaning='http://www.w3.org/2004/02/skos/core#narrowerMatch'),
  'contexts': ['https://bitbucket.org/berkeleylab/jgi-jat/macros/nmdc_metadata.yaml']
}))"			
Biosample	abs_air_humidity			absolute air humidity	measurement value	1	gram per gram, kilogram per kilogram, kilogram, pound							Actual mass of water vapor - mh20 - present in the air water vapor mixture			9 gram per gram					core field												QuantityValue						MIXS:0000122				absolute air humidity	
Biosample	add_date													The date on which the information was added to the database.																				string											
Biosample	add_recov_method			secondary and tertiary recovery methods and start date	enumeration;timestamp	1								"Additional (i.e. Secondary, tertiary, etc.) recovery methods deployed for increase of hydrocarbon recovery from resource and start date for each one of them. If ""other"" is specified, please propose entry in ""additional info"" field"			Polymer Addition;2018-06-21T14:30Z					core field												TextValue						MIXS:0001009				secondary and tertiary recovery methods and start date	
Biosample	additional_info			additional info	text	1								Information that doesn't fit anywhere else. Can also be used to propose new entries for fields with controlled vocabulary								core field												TextValue						MIXS:0000300	{text}			additional info	
Biosample	address			address	value	1								The street name and building number where the sampling occurred.								core field												TextValue						MIXS:0000218	{integer}{text}			address	
Biosample	adj_room			adjacent rooms	room name;room number	1								List of rooms (room number, room name) immediately adjacent to the sampling room								core field												TextValue						MIXS:0000219	{text};{integer}			adjacent rooms	
Biosample	aero_struc			aerospace structure	enumeration	1								Aerospace structures typically consist of thin plates with stiffeners for the external surfaces, bulkheads and frames to support the shape and fasteners such as welds, rivets, screws and bolts to hold the components together			plane					core field												TextValue						MIXS:0000773	[plane|glider]			aerospace structure	
Biosample	agrochem_addition			history/agrochemical additions	agrochemical name;agrochemical amount;timestamp	m	gram, mole per liter, milligram per liter							Addition of fertilizers, pesticides, etc. - amount and time of applications			roundup;5 milligram per liter;2018-06-21				True	core field								True				TextValue						MIXS:0000639	{text};{float} {unit};{timestamp}			history/agrochemical additions	
Biosample	air_PM_concen			air particulate matter concentration	particulate matter name;measurement value	m	micrograms per cubic meter							Concentration of substances that remain suspended in the air, and comprise mixtures of organic and inorganic substances (PM10 and PM2.5); can report multiple PM's by entering numeric values preceded by name of PM			PM2.5;10 microgram per cubic meter				True	core field								True				TextValue						MIXS:0000108	{text};{float} {unit}			air particulate matter concentration	
Biosample	air_temp			air temperature	measurement value	1	degree Celsius							Temperature of the air at the time of sampling			20 degree Celsius					core field												QuantityValue						MIXS:0000124				air temperature	
Biosample	air_temp_regm			air temperature regimen	temperature value;treatment interval and duration	m	meter							Information about treatment involving an exposure to varying temperatures; should include the temperature, treatment regimen including how many times the treatment was repeated, how long each treatment lasted, and the start and end time of the entire treatment; can include different temperature regimens			25 degree Celsius;R2/2018-05-11T14:30/2018-05-11T19:30/P1H30M				True	core field								True				TextValue						MIXS:0000551	{float} {unit};{Rn/start_time/end_time/duration}			air temperature regimen	
Biosample	al_sat			extreme_unusual_properties/Al saturation	measurement value	1	percentage							The relative abundance of aluminum in the sample			27%					core field										Aluminum saturation is the percentage of the CEC occupies by aluminum. Like all cations, aluminum held by the cation exchange complex is in equilibrium with aluminum in the soil solution.		QuantityValue						MIXS:0000607				aluminum saturation/ extreme unusual properties	Example & validation. Can we configure things so that 27% & 27 % & 0.27 will validate?|I think it's weird the way GSC writes the title. I recommend this change. Thoughts? I would argue this isn't an extreme unusual property. It's just a biogeochemical measurement.
Biosample	al_sat_meth			extreme_unusual_properties/Al saturation method	PMID,DOI or URL	1						Required when aluminum saturation is provided.		Reference or method used in determining Aluminum saturation			https://doi.org/10.1371/journal.pone.0176357					core field												TextValue						MIXS:0000324	{PMID}|{DOI}|{URL}			aluminum saturation method/ extreme unusual properties	I think it's weird the way GSC writes the title. I recommend this change. Thoughts?
Biosample	alkalinity			alkalinity	measurement value	1	milliequivalent per liter, milligram per liter							Alkalinity, the ability of a solution to neutralize acids to the equivalence point of carbonate or bicarbonate			50 milligram per liter					core field												QuantityValue						MIXS:0000421				alkalinity	
Biosample	alkalinity_method			alkalinity method	description of method	1								Method used for alkalinity measurement			titration					core field												TextValue						MIXS:0000298	{text}			alkalinity method	
Biosample	alkyl_diethers			alkyl diethers	measurement value	1	mole per liter							Concentration of alkyl diethers			0.005 mole per liter					core field												QuantityValue						MIXS:0000490				alkyl diethers	
Biosample	alt			altitude	measurement value									Altitude is a term used to identify heights of objects such as airplanes, space shuttles, rockets, atmospheric balloons and heights of places such as atmospheric layers and clouds. It is used to measure the height of an object which is above the earth's surface. In this context, the altitude measurement is the vertical distance between the earth's surface above sea level and the sampled position in the air			100 meter					environment field												QuantityValue						MIXS:0000094				altitude	
Biosample	alternative_identifiers													Unique identifier for a biosample submitted to additional resources. Matches the entity that has been submitted to NMDC																True			^[a-zA-Z0-9][a-zA-Z0-9_\.]+:[a-zA-Z0-9_][a-zA-Z0-9_\-\/\.,\(\)\=\#]*$	uriorcurie											
Biosample	aminopept_act			aminopeptidase activity	measurement value	1	mole per liter per hour							Measurement of aminopeptidase activity			0.269 mole per liter per hour					core field												QuantityValue						MIXS:0000172				aminopeptidase activity	
Biosample	ammonium			ammonium	measurement value	1	micromole per liter, milligram per liter, parts per million							Concentration of ammonium in the sample			1.5 milligram per liter					core field												QuantityValue						MIXS:0000427				ammonium	
Biosample	ammonium_nitrogen			ammonium_nitrogen|NH4-N	measurement value	1	mg/kg							Concentration of ammonium nitrogen in the sample			2.3 mg/kg																	QuantityValue				https://www.ornl.gov/content/bio-scales-0						ammonium nitrogen	
Biosample	amount_light			amount of light	measurement value	1	lux, lumens per square meter							The unit of illuminance and luminous emittance, measuring luminous flux per unit area								core field												QuantityValue						MIXS:0000140				amount of light	
Biosample	analysis_type													Select all the data types associated or available for this biosample			metagenomics; metabolomics; metaproteomics													True				AnalysisTypeEnum	3.0	True		MIxS:investigation_type	Sample ID					analysis/data type	
Biosample	ances_data			ancestral data	free text	1								Information about either pedigree or other ancestral information description (e.g. parental variety in case of mutant or selection), e.g. A/3*B (meaning [(A x B) x B] x B)			A/3*B					core field												TextValue						MIXS:0000247	{text}			ancestral data	
Biosample	annual_precpt			mean annual precipitation	measurement value	1	millimeter							The average of all annual precipitation values known, or an estimated equivalent value derived by such methods as regional indexes or Isohyetal maps.			8.94 inch					core field												QuantityValue						MIXS:0000644				mean annual precipitation	
Biosample	annual_temp			mean annual temperature	measurement value	1	degree Celsius							Mean annual temperature			12.5 degree Celsius					core field												QuantityValue						MIXS:0000642				mean annual temperature	
Biosample	antibiotic_regm			antibiotic regimen	antibiotic name;antibiotic amount;treatment interval and duration	m	milligram							Information about treatment involving antibiotic administration; should include the name of antibiotic, amount administered, treatment regimen including how many times the treatment was repeated, how long each treatment lasted, and the start and end time of the entire treatment; can include multiple antibiotic regimens			penicillin;5 milligram;R2/2018-05-11T14:30/2018-05-11T19:30/P1H30M				True	core field								True				TextValue						MIXS:0000553	{text};{float} {unit};{Rn/start_time/end_time/duration}			antibiotic regimen	
Biosample	api			API gravity	measurement value	1	degrees API							API gravity is a measure of how heavy or light a petroleum liquid is compared to water (source: https://en.wikipedia.org/wiki/API_gravity) (e.g. 31.1¬∞ API)								core field												QuantityValue						MIXS:0000157				API gravity	
Biosample	arch_struc			architectural structure	enumeration	1								An architectural structure is a human-made, free-standing, immobile outdoor construction			shed					core field												arch_struc_enum						MIXS:0000774				architectural structure	
Biosample	aromatics_pc			aromatics wt%	name;measurement value	1	percent							Saturate, Aromatic, Resin and Asphaltene¬†(SARA) is an analysis method that divides¬†crude oil¬†components according to their polarizability and polarity. There are three main methods to obtain SARA results. The most popular one is known as the Iatroscan TLC-FID and is referred to as IP-143 (source: https://en.wikipedia.org/wiki/Saturate,_aromatic,_resin_and_asphaltene)								core field												TextValue						MIXS:0000133	{text};{float} {unit}			aromatics wt%	
Biosample	asphaltenes_pc			asphaltenes wt%	name;measurement value	1	percent							Saturate, Aromatic, Resin and Asphaltene¬†(SARA) is an analysis method that divides¬†crude oil¬†components according to their polarizability and polarity. There are three main methods to obtain SARA results. The most popular one is known as the Iatroscan TLC-FID and is referred to as IP-143 (source: https://en.wikipedia.org/wiki/Saturate,_aromatic,_resin_and_asphaltene)								core field												TextValue						MIXS:0000135	{text};{float} {unit}			asphaltenes wt%	
Biosample	associated_studies													The study associated with a resource.																True			^(nmdc):sty-([0-9][a-z]{0,6}[0-9])-([A-Za-z0-9]{1,})$	Study			True						{id_nmdc_prefix}:sty-{id_shoulder}-{id_blade}$		
Biosample	atmospheric_data			atmospheric data	atmospheric data name;measurement value	m								Measurement of atmospheric data; can include multiple data			wind speed;9 knots				True	core field								True				TextValue						MIXS:0001097	{text};{float} {unit}			atmospheric data	
Biosample	avg_dew_point			average dew point	measurement value	1	degree Celsius							The average of dew point measures taken at the beginning of every hour over a 24 hour period on the sampling day			25.5 degree Celsius					core field												QuantityValue						MIXS:0000141				average dew point	
Biosample	avg_occup			average daily occupancy	value	1								Daily average occupancy of room. Indicate the number of person(s) daily occupying the sampling room.			2					core field												TextValue						MIXS:0000775				average daily occupancy	
Biosample	avg_temp			average temperature	measurement value	1	degree Celsius							The average of temperatures taken at the beginning of every hour over a 24 hour period on the sampling day			12.5 degree Celsius					core field												QuantityValue						MIXS:0000142				average temperature	
Biosample	bac_prod			bacterial production	measurement value	1	milligram per cubic meter per day							Bacterial production in the water column measured by isotope uptake			5 milligram per cubic meter per day					core field												QuantityValue						MIXS:0000683				bacterial production	
Biosample	bac_resp			bacterial respiration	measurement value	1	milligram per cubic meter per day, micromole oxygen per liter per hour							Measurement of bacterial respiration in the water column			300 micromole oxygen per liter per hour					core field												QuantityValue						MIXS:0000684				bacterial respiration	
Biosample	bacteria_carb_prod			bacterial carbon production	measurement value	1	nanogram per hour							Measurement of bacterial carbon production			2.53 microgram per liter per hour					core field												QuantityValue						MIXS:0000173				bacterial carbon production	
Biosample	barometric_press			barometric pressure	measurement value	1	millibar							Force per unit area exerted against a surface by the weight of air above that surface			5 millibar					core field												QuantityValue						MIXS:0000096				barometric pressure	
Biosample	basin			basin name	name	1								Name of the basin (e.g. Campos)								core field												TextValue						MIXS:0000290	{text}			basin name	
Biosample	bathroom_count			bathroom count	value	1								The number of bathrooms in the building			1					core field												TextValue						MIXS:0000776				bathroom count	
Biosample	bedroom_count			bedroom count	value	1								The number of bedrooms in the building			2					core field												TextValue						MIXS:0000777				bedroom count	
Biosample	benzene			benzene	measurement value	1	milligram per liter, parts per million							Concentration of benzene in the sample								core field												QuantityValue						MIXS:0000153				benzene	
Biosample	biochem_oxygen_dem			biochemical oxygen demand	measurement value	1	milligram per liter							Amount of dissolved oxygen needed by aerobic biological organisms in a body of water to break down organic material present in a given water sample at certain temperature over a specific time period								core field												QuantityValue						MIXS:0000653				biochemical oxygen demand	
Biosample	biocide			biocide administration	name;name;timestamp	1								List of biocides (commercial name of product and supplier) and date of administration			ALPHA 1427;Baker Hughes;2008-01-23					core field												TextValue						MIXS:0001011	{text};{text};{timestamp}			biocide administration	
Biosample	biocide_admin_method			biocide administration method	measurement value;frequency;duration;duration	1	milligram per liter							Method of biocide administration (dose, frequency, duration, time elapsed between last biociding and sampling) (e.g. 150 mg/l; weekly; 4 hr; 3 days)								core field												TextValue						MIXS:0000456	{float} {unit};{Rn/start_time/end_time/duration};{duration}			biocide administration method	
Biosample	biol_stat			biological status	enumeration	1								The level of genome modification.			natural					core field												biol_stat_enum						MIXS:0000858				biological status	
Biosample	biomass			biomass	biomass type;measurement value	m	ton, kilogram, gram							Amount of biomass; should include the name for the part of biomass measured, e.g. Microbial, total. Can include multiple measurements			total;20 gram				True	core field								True				TextValue						MIXS:0000174	{text};{float} {unit}			biomass	
Biosample	biosample_categories																													True				BiosampleCategoryEnum										Categories the biosample belongs to	
Biosample	biotic_regm			biotic regimen	free text	1								Information about treatment(s) involving use of biotic factors, such as bacteria, viruses or fungi.			sample inoculated with Rhizobium spp. Culture					core field												TextValue						MIXS:0001038	{text}			biotic regimen	
Biosample	biotic_relationship			observed biotic relationship	enumeration									Description of relationship(s) between the subject organism and other organism(s) it is associated with. E.g., parasite on species X; mutualist with species Y. The target organism is the subject of the relationship, and the other organism(s) is the object			free living					nucleic acid sequence source field												biotic_relationship_enum						MIXS:0000028				observed biotic relationship	
Biosample	bishomohopanol			bishomohopanol	measurement value	1	microgram per liter, microgram per gram							Concentration of bishomohopanol			14 microgram per liter					core field												QuantityValue						MIXS:0000175				bishomohopanol	
Biosample	blood_press_diast			host blood pressure diastolic	measurement value	1	millimeter mercury							Resting diastolic blood pressure, measured as mm mercury								core field												QuantityValue						MIXS:0000258				host blood pressure diastolic	
Biosample	blood_press_syst			host blood pressure systolic	measurement value	1	millimeter mercury							Resting systolic blood pressure, measured as mm mercury								core field												QuantityValue						MIXS:0000259				host blood pressure systolic	
Biosample	bromide			bromide	measurement value	1	parts per million							Concentration of bromide			0.05 parts per million					core field												QuantityValue						MIXS:0000176				bromide	
Biosample	build_docs			design, construction, and operation documents	enumeration	1								The building design, construction and operation documents			maintenance plans					core field												build_docs_enum						MIXS:0000787				design, construction, and operation documents	
Biosample	build_occup_type			building occupancy type	enumeration	m								The primary function for which a building or discrete part of a building is intended to be used			market					core field								True				build_occup_type_enum						MIXS:0000761				building occupancy type	
Biosample	building_setting			building setting	enumeration	1								A location (geography) where a building is set			rural					core field												building_setting_enum						MIXS:0000768				building setting	
Biosample	built_struc_age			built structure age	value	1	year							The age of the built structure since construction			15					core field												QuantityValue						MIXS:0000145				built structure age	
Biosample	built_struc_set			built structure setting	enumeration	1								The characterization of the location of the built structure as high or low human density			rural					core field												TextValue						MIXS:0000778	[urban|rural]			built structure setting	
Biosample	built_struc_type			built structure type	free text	1								A physical structure that is a body or assemblage of bodies in space to form a system capable of supporting loads								core field												TextValue						MIXS:0000721	{text}			built structure type	
Biosample	bulk_elect_conductivity											Provide the value output of the field instrument.		Electrical conductivity is a measure of the ability to carry electric current, which is mostly dictated by the chemistry of and amount of water.			JsonObj(has_raw_value='0.017 mS/cm', has_numeric_value=0.017, has_unit='mS/cm')																	QuantityValue										bulk electrical conductivity	
Biosample	calcium			calcium	measurement value	1	milligram per liter, micromole per liter, parts per million							Concentration of calcium in the sample			0.2 micromole per liter					core field												QuantityValue						MIXS:0000432				calcium	
Biosample	carb_dioxide			carbon dioxide	measurement value	1	micromole per liter, parts per million							Carbon dioxide (gas) amount or concentration at the time of sampling			410 parts per million					core field												QuantityValue						MIXS:0000097				carbon dioxide	
Biosample	carb_monoxide			carbon monoxide	measurement value	1	micromole per liter, parts per million							Carbon monoxide (gas) amount or concentration at the time of sampling			0.1 parts per million					core field												QuantityValue						MIXS:0000098				carbon monoxide	
Biosample	carb_nitro_ratio			carbon/nitrogen ratio	measurement value	1								Ratio of amount or concentrations of carbon to nitrogen			0.417361111					core field												QuantityValue						MIXS:0000310				carbon/nitrogen ratio	
Biosample	ceil_area			ceiling area	measurement value	1	square meter							The area of the ceiling space within the room			25 square meter					core field												QuantityValue						MIXS:0000148				ceiling area	
Biosample	ceil_cond			ceiling condition	enumeration	1								The physical condition of the ceiling at the time of sampling; photos or video preferred; use drawings to indicate location of damaged areas			damaged					core field												ceil_cond_enum						MIXS:0000779				ceiling condition	
Biosample	ceil_finish_mat			ceiling finish material	enumeration	1								The type of material used to finish a ceiling			stucco					core field												ceil_finish_mat_enum						MIXS:0000780				ceiling finish material	
Biosample	ceil_struc			ceiling structure	enumeration	1								The construction format of the ceiling			concrete					core field												TextValue						MIXS:0000782	[wood frame|concrete]			ceiling structure	
Biosample	ceil_texture			ceiling texture	enumeration	1								The feel, appearance, or consistency of a ceiling surface			popcorn					core field												ceil_texture_enum						MIXS:0000783				ceiling texture	
Biosample	ceil_thermal_mass			ceiling thermal mass	measurement value	1	joule per degree Celsius							The ability of the ceiling to provide inertia against temperature fluctuations. Generally this means concrete that is exposed. A metal deck that supports a concrete slab will act thermally as long as it is exposed to room air flow								core field												QuantityValue						MIXS:0000143				ceiling thermal mass	
Biosample	ceil_type			ceiling type	enumeration	1								The type of ceiling according to the ceiling's appearance or construction			coffered					core field												ceil_type_enum						MIXS:0000784				ceiling type	
Biosample	ceil_water_mold			ceiling signs of water/mold	enumeration	1								Signs of the presence of mold or mildew on the ceiling			presence of mold visible					core field												TextValue						MIXS:0000781	[presence of mold visible|no presence of mold visible]			ceiling signs of water/mold	
Biosample	chem_administration			chemical administration	CHEBI;timestamp	m								List of chemical compounds administered to the host or site where sampling occurred, and when (e.g. Antibiotics, n fertilizer, air filter); can include multiple compounds. For chemical entities of biological interest ontology (chebi) (v 163), http://purl.bioontology.org/ontology/chebi			agar [CHEBI:2509];2018-05-11T20:00Z				True	core field								True				ControlledTermValue						MIXS:0000751	{termLabel} {[termID]};{timestamp}			chemical administration	
Biosample	chem_mutagen			chemical mutagen	mutagen name;mutagen amount;treatment interval and duration	m	milligram per liter							Treatment involving use of mutagens; should include the name of mutagen, amount administered, treatment regimen including how many times the treatment was repeated, how long each treatment lasted, and the start and end time of the entire treatment; can include multiple mutagen regimens			nitrous acid;0.5 milligram per liter;R2/2018-05-11T14:30/2018-05-11T19:30/P1H30M				True	core field								True				TextValue						MIXS:0000555	{text};{float} {unit};{Rn/start_time/end_time/duration}			chemical mutagen	
Biosample	chem_oxygen_dem			chemical oxygen demand	measurement value	1	milligram per liter							A measure of the capacity of water to consume oxygen during the decomposition of organic matter and the oxidation of inorganic chemicals such as ammonia and nitrite								core field												QuantityValue						MIXS:0000656				chemical oxygen demand	
