class	slot	abstract	alias	aliases	annotation_expected_value	annotation_occurrence	annotation_preferred_unit	annotation_tooltip	any_of	broad_mappings	close_mappings	comments	contributors	description	designates_type	exact_mappings	example_values	id_prefixes	identifier	inlined	inlined_as_list	is_a	list_elements_ordered	mappings	maximum_cardinality	maximum_value	minimum_cardinality	minimum_value	mixins	multivalued	narrow_mappings	notes	pattern	range	rank	recommended	required	see_also	slot_group	slot_uri	string_serialization	structured_aliases	structured_pattern.syntax	title	todos
Biosample	rna_organisms													List any organisms known or suspected to grow in co-culture, as well as estimated % of the organism in that culture.			expected to contain microbes (59%) fungi (30%), viruses (10%), tadpoles (1%)																	string	14.0	True			JGI-Metatranscriptomics		{text}			RNA expected organisms	
Biosample	rna_project_contact											Do not edit these values. A template will be provided by NMDC in which these values have been pre-filled.					John Jones																	string	18.0	True			JGI-Metatranscriptomics		{text}			RNA seq project contact	
Biosample	rna_samp_id											Do not edit these values. A template will be provided by NMDC in which these values have been pre-filled.					187654																	string	3.0	True			JGI-Metatranscriptomics		{text}			RNA sample ID	
Biosample	rna_sample_format													Solution in which the RNA sample has been suspended			Water																	RNASampleFormatEnum	12.0	True			JGI-Metatranscriptomics					RNA sample format	
Biosample	rna_sample_name													Give the RNA sample a name that is meaningful to you. Sample names must be unique across all JGI projects and contain a-z, A-Z, 0-9, - and _ only.			JGI_pond_041618									2000.0								string	4.0	True			JGI-Metatranscriptomics		{text}			RNA sample name	
Biosample	rna_seq_project			Seq Project ID								Do not edit these values. A template will be provided by NMDC in which these values have been pre-filled.					1191234																	string	1.0	True			JGI-Metatranscriptomics		{text}			RNA seq project ID	
Biosample	rna_seq_project_name											Do not edit these values. A template will be provided by NMDC in which these values have been pre-filled.					JGI Pond metatranscriptomics																	string	2.0	True			JGI-Metatranscriptomics		{text}			RNA seq project name	
Biosample	rna_seq_project_pi											Do not edit these values. A template will be provided by NMDC in which these values have been pre-filled.					Jane Johnson																	string	17.0	True			JGI-Metatranscriptomics		{text}			RNA seq project PI	
Biosample	rna_volume											Units must be in uL. Enter the numerical part only. Value must be 0-1000. This form accepts values < 25, but JGI may refuse to process them unless permission has been granted by a project manager					25									1000.0								float	6.0	True			JGI-Metatranscriptomics		{float}			RNA volume in ul	
Biosample	room_air_exch_rate			room air exchange rate	measurement value	1	liter per hour							The rate at which outside air replaces indoor air in a given space								core field												QuantityValue						MIXS:0000169				room air exchange rate	
Biosample	room_architec_elem			room architectural elements	free text	1								The unique details and component parts that, together, form the architecture of a distinguisahable space within a built structure								core field												string						MIXS:0000233	{text}			room architectural elements	
Biosample	room_condt			room condition	enumeration	1								The condition of the room at the time of sampling			new					core field												room_condt_enum						MIXS:0000822				room condition	
Biosample	room_connected			rooms connected by a doorway	enumeration	1								List of rooms connected to the sampling room by a doorway			office					core field												room_connected_enum						MIXS:0000826				rooms connected by a doorway	
Biosample	room_count			room count	value	1								The total count of rooms in the built structure including all room types								core field												TextValue						MIXS:0000234				room count	
Biosample	room_dim			room dimensions	measurement value	1	meter							The length, width and height of sampling room								core field												TextValue						MIXS:0000192	{integer} {unit} x {integer} {unit} x {integer} {unit}			room dimensions	
Biosample	room_door_dist			room door distance	measurement value	1	meter							Distance between doors (meters) in the hallway between the sampling room and adjacent rooms								core field												TextValue						MIXS:0000193	{integer} {unit}			room door distance	
Biosample	room_door_share			rooms that share a door with sampling room	room name;room number	1								List of room(s) (room number, room name) sharing a door with the sampling room								core field												TextValue						MIXS:0000242	{text};{integer}			rooms that share a door with sampling room	
Biosample	room_hallway			rooms that are on the same hallway	room name;room number	1								List of room(s) (room number, room name) located in the same hallway as sampling room								core field												TextValue						MIXS:0000238	{text};{integer}			rooms that are on the same hallway	
Biosample	room_loc			room location in building	enumeration	1								The position of the room within the building			interior room					core field												room_loc_enum						MIXS:0000823				room location in building	
Biosample	room_moist_dam_hist			room moisture damage or mold history	value	1								The history of moisture damage or mold in the past 12 months. Number of events of moisture damage or mold observed								core field												integer						MIXS:0000235				room moisture damage or mold history	
Biosample	room_net_area			room net area	measurement value	1	square feet, square meter							The net floor area of sampling room. Net area excludes wall thicknesses								core field												TextValue						MIXS:0000194	{integer} {unit}			room net area	
Biosample	room_occup			room occupancy	measurement value	1								Count of room occupancy at time of sampling								core field												QuantityValue						MIXS:0000236				room occupancy	
Biosample	room_samp_pos			room sampling position	enumeration	1								The horizontal sampling position in the room relative to architectural elements			south corner					core field												room_samp_pos_enum						MIXS:0000824				room sampling position	
Biosample	room_type			room type	enumeration	1								The main purpose or activity of the sampling room. A room is any distinguishable space within a structure			bathroom					core field												room_type_enum						MIXS:0000825				room type	
Biosample	room_vol			room volume	measurement value	1	cubic feet, cubic meter							Volume of sampling room								core field												TextValue						MIXS:0000195	{integer} {unit}			room volume	
Biosample	room_wall_share			rooms that share a wall with sampling room	room name;room number	1								List of room(s) (room number, room name) sharing a wall with the sampling room								core field												TextValue						MIXS:0000243	{text};{integer}			rooms that share a wall with sampling room	
Biosample	room_window_count			room window count	value	1								Number of windows in the room								core field												integer						MIXS:0000237				room window count	
Biosample	root_cond			rooting conditions	PMID,DOI,url or free text	1								Relevant rooting conditions such as field plot size, sowing density, container dimensions, number of plants per container.			http://himedialabs.com/TD/PT158.pdf					core field												TextValue						MIXS:0001061	{PMID}|{DOI}|{URL}|{text}			rooting conditions	
Biosample	root_med_carbon			rooting medium carbon	carbon source name;measurement value	1	milligram per liter							Source of organic carbon in the culture rooting medium; e.g. sucrose.			sucrose					core field												TextValue						MIXS:0000577	{text};{float} {unit}			rooting medium carbon	
Biosample	root_med_macronutr			rooting medium macronutrients	macronutrient name;measurement value	1	milligram per liter							Measurement of the culture rooting medium macronutrients (N,P, K, Ca, Mg, S); e.g. KH2PO4 (170¬†mg/L).			KH2PO4;170¬†milligram per liter					core field												TextValue						MIXS:0000578	{text};{float} {unit}			rooting medium macronutrients	
Biosample	root_med_micronutr			rooting medium micronutrients	micronutrient name;measurement value	1	milligram per liter							Measurement of the culture rooting medium micronutrients (Fe, Mn, Zn, B, Cu, Mo); e.g. H3BO3 (6.2¬†mg/L).			H3BO3;6.2¬†milligram per liter					core field												TextValue						MIXS:0000579	{text};{float} {unit}			rooting medium micronutrients	
Biosample	root_med_ph			rooting medium pH	measurement value	1								pH measurement of the culture rooting medium; e.g. 5.5.			7.5					core field												QuantityValue						MIXS:0001062				rooting medium pH	
Biosample	root_med_regl			rooting medium regulators	regulator name;measurement value	1	milligram per liter							Growth regulators in the culture rooting medium such as cytokinins, auxins, gybberellins, abscisic acid; e.g. 0.5¬†mg/L NAA.			abscisic acid;0.75 milligram per liter					core field												TextValue						MIXS:0000581	{text};{float} {unit}			rooting medium regulators	
Biosample	root_med_solid			rooting medium solidifier	name	1								Specification of the solidifying agent in the culture rooting medium; e.g. agar.			agar					core field												TextValue						MIXS:0001063	{text}			rooting medium solidifier	
Biosample	root_med_suppl			rooting medium organic supplements	supplement name;measurement value	1	milligram per liter							Organic supplements of the culture rooting medium, such as vitamins, amino acids, organic acids, antibiotics activated charcoal; e.g. nicotinic acid (0.5¬†mg/L).			nicotinic acid;0.5 milligram per liter					core field												TextValue						MIXS:0000580	{text};{float} {unit}			rooting medium organic supplements	
Biosample	salinity			salinity	measurement value	1	practical salinity unit, percentage							The total concentration of all dissolved salts in a liquid or solid sample. While salinity can be measured by a complete chemical analysis, this method is difficult and time consuming. More often, it is instead derived from the conductivity measurement. This is known as practical salinity. These derivations compare the specific conductance of the sample to a salinity standard such as seawater.			25 practical salinity unit					core field												QuantityValue						MIXS:0000183				salinity	
Biosample	salinity_category													Categorical description of the sample's salinity. Examples: halophile, halotolerant, hypersaline, huryhaline																		maps to gold:salinity		string				https://github.com/microbiomedata/nmdc-metadata/pull/297							
Biosample	salinity_meth			salinity method	PMID,DOI or url	1								Reference or method used in determining salinity			https://doi.org/10.1007/978-1-61779-986-0_28					core field												TextValue						MIXS:0000341	{PMID}|{DOI}|{URL}			salinity method	
Biosample	salt_regm			salt regimen	salt name;salt amount;treatment interval and duration	m	gram, microgram, mole per liter, gram per liter							Information about treatment involving use of salts as supplement to liquid and soil growth media; should include the name of salt, amount administered, treatment regimen including how many times the treatment was repeated, how long each treatment lasted, and the start and end time of the entire treatment; can include multiple salt regimens			NaCl;5 gram per liter;R2/2018-05-11T14:30/2018-05-11T19:30/P1H30M				True	core field								True				TextValue						MIXS:0000582	{text};{float} {unit};{Rn/start_time/end_time/duration}			salt regimen	
Biosample	samp_capt_status			sample capture status	enumeration	1								Reason for the sample			farm sample					core field												samp_capt_status_enum						MIXS:0000860				sample capture status	
Biosample	samp_collec_device			sample collection device	device name									The device used to collect an environmental sample. This field accepts terms listed under environmental sampling device (http://purl.obolibrary.org/obo/ENVO). This field also accepts terms listed under specimen collection device (http://purl.obolibrary.org/obo/GENEPIO_0002094).			swab, biopsy, niskin bottle, push core, drag swab [GENEPIO:0002713]					nucleic acid sequence source field												string						MIXS:0000002	{termLabel} {[termID]}|{text}			sample collection device	
Biosample	samp_collec_method			sample collection method	PMID,DOI,url , or text									The method employed for collecting the sample.			swabbing					nucleic acid sequence source field												string						MIXS:0001225	{PMID}|{DOI}|{URL}|{text}			sample collection method	
Biosample	samp_collect_point			sample collection point	enumeration	1								"Sampling point on the asset were sample was collected (e.g. Wellhead, storage tank, separator, etc). If ""other"" is specified, please propose entry in ""additional info"" field"			well					core field												samp_collect_point_enum						MIXS:0001015				sample collection point	
Biosample	samp_dis_stage			sample disease stage	enumeration	1								Stage of the disease at the time of sample collection, e.g. inoculation, penetration, infection, growth and reproduction, dissemination of pathogen.			infection					core field												samp_dis_stage_enum						MIXS:0000249				sample disease stage	
Biosample	samp_floor			sampling floor	enumeration	1								The floor of the building, where the sampling room is located			4th floor					core field												samp_floor_enum						MIXS:0000828				sampling floor	
Biosample	samp_loc_corr_rate			corrosion rate at sample location	measurement value range	1	millimeter per year							Metal corrosion rate is the speed of metal deterioration due to environmental conditions. As environmental conditions change corrosion rates change accordingly. Therefore, long term corrosion rates are generally more informative than short term rates and for that reason they are preferred during reporting. In the case of suspected MIC, corrosion rate measurements at the time of sampling might provide insights into the involvement of certain microbial community members in MIC as well as potential microbial interplays								core field												TextValue						MIXS:0000136	{float} - {float} {unit}			corrosion rate at sample location	
Biosample	samp_mat_process			sample material processing	text									A brief description of any processing applied to the sample during or after retrieving the sample from environment, or a link to the relevant protocol(s) performed.			filtering of seawater, storing samples in ethanol					nucleic acid sequence source field												ControlledTermValue						MIXS:0000016	{text}			sample material processing	
Biosample	samp_md			sample measured depth	measurement value;enumeration	1	meter							"In non deviated well, measured depth is equal to the true vertical depth, TVD (TVD=TVDSS plus the reference or datum it refers to). In deviated wells, the MD is the length of trajectory of the borehole measured from the same reference or datum. Common datums used are ground level (GL), drilling rig floor (DF), rotary table (RT), kelly bushing (KB) and mean sea level (MSL). If ""other"" is specified, please propose entry in ""additional info"" field"			1534 meter;MSL					core field												QuantityValue						MIXS:0000413				sample measured depth	
Biosample	samp_name			sample name	text									A local identifier or name that for the material sample used for extracting nucleic acids, and subsequent sequencing. It can refer either to the original material collected or to any derived sub-samples. It can have any format, but we suggest that you make it concise, unique and consistent within your lab, and as informative as possible. INSDC requires every sample name from a single Submitter to be unique. Use of a globally unique identifier for the field source_mat_id is recommended in addition to sample_name.			ISDsoil1					investigation field												string						MIXS:0001107	{text}			sample name	
Biosample	samp_preserv			preservative added to sample	name;measurement value	1	milliliter							Preservative added to the sample (e.g. Rnalater, alcohol, formaldehyde, etc.). Where appropriate include volume added (e.g. Rnalater; 2 ml)								core field												TextValue						MIXS:0000463	{text};{float} {unit}			preservative added to sample	
Biosample	samp_room_id			sampling room ID or name	value	1								Sampling room number. This ID should be consistent with the designations on the building floor plans								core field												TextValue						MIXS:0000244				sampling room ID or name	
Biosample	samp_size			amount or size of sample collected	measurement value		millliter, gram, milligram, liter							The total amount or size (volume (ml), mass (g) or area (m2) ) of sample collected.			5 liter					nucleic acid sequence source field												QuantityValue						MIXS:0000001				amount or size of sample collected	
Biosample	samp_sort_meth			sample size sorting method	description of method	m								Method by which samples are sorted; open face filter collecting total suspended particles, prefilter to remove particles larger than X micrometers in diameter, where common values of X would be 10 and 2.5 full size sorting in a cascade impactor.							True	core field								True				TextValue						MIXS:0000216	{text}			sample size sorting method	
Biosample	samp_store_dur			sample storage duration	duration	1								Duration for which the sample was stored			P1Y6M					core field												TextValue						MIXS:0000116	{duration}			sample storage duration	
Biosample	samp_store_loc			sample storage location	location name	1								Location at which sample was stored, usually name of a specific freezer/room			Freezer no:5					core field												TextValue						MIXS:0000755	{text}			sample storage location	
Biosample	samp_store_temp			sample storage temperature	measurement value	1	degree Celsius							Temperature at which sample was stored, e.g. -80 degree Celsius			-80 degree Celsius					core field												QuantityValue						MIXS:0000110				sample storage temperature	
Biosample	samp_subtype			sample subtype	enumeration	1								"Name of sample sub-type. For example if ""sample type"" is ""Produced Water"" then subtype could be ""Oil Phase"" or ""Water Phase"". If ""other"" is specified, please propose entry in ""additional info"" field"			biofilm					core field												samp_subtype_enum						MIXS:0000999				sample subtype	
Biosample	samp_taxon_id			Taxonomy ID of DNA sample	Taxonomy ID							coal metagenome [NCBITaxon:1260732] would be a reasonable has_raw_value		NCBI taxon id of the sample.  Maybe be a single taxon or mixed taxa sample. Use 'synthetic metagenome’ for mock community/positive controls, or 'blank sample' for negative controls.								investigation field												ControlledIdentifiedTermValue						MIXS:0001320				Taxonomy ID of DNA sample	
Biosample	samp_time_out			sampling time outside	time	1	hour							The recent and long term history of outside sampling								core field												TextValue						MIXS:0000196				sampling time outside	
Biosample	samp_transport_cond			sample transport conditions	measurement value;measurement value	1	days;degree Celsius							Sample transport duration (in days or hrs) and temperature the sample was exposed to (e.g. 5.5 days; 20 ¬∞C)			5 days;-20 degree Celsius					core field												TextValue						MIXS:0000410	{float} {unit};{float} {unit}			sample transport conditions	
Biosample	samp_tvdss			sample true vertical depth subsea	measurement value or measurement value range	1	meter							Depth of the sample i.e. The vertical distance between the sea level and the sampled position in the subsurface. Depth can be reported as an interval for subsurface samples e.g. 1325.75-1362.25 m								core field												TextValue						MIXS:0000409	{float}-{float} {unit}			sample true vertical depth subsea	
Biosample	samp_type			sample type	GENEPIO:0001246	1								The type of material from which the sample was obtained. For the Hydrocarbon package, samples include types like core, rock trimmings, drill cuttings, piping section, coupon, pigging debris, solid deposit, produced fluid, produced water, injected water, swabs, etc. For the Food Package, samples are usually categorized as food, body products or tissues, or environmental material. This field accepts terms listed under environmental specimen (http://purl.obolibrary.org/obo/GENEPIO_0001246).			built environment sample [GENEPIO:0001248]					core field												TextValue						MIXS:0000998	{termLabel} {[termID]}			sample type	
Biosample	samp_weather			sampling day weather	enumeration	1								The weather on the sampling day			foggy					core field												samp_weather_enum						MIXS:0000827				sampling day weather	
Biosample	samp_well_name			sample well name	name	1								Name of the well (e.g. BXA1123) where sample was taken								core field												TextValue						MIXS:0000296	{text}			sample well name	
Biosample	sample_collection_site																																	string											
Biosample	sample_link											This field allows multiple entries separated by ; (Examples: Soil collected from the field will link with the soil used in an incubation. The soil a plant was grown in links to the plant sample. An original culture sample was transferred to a new vial and generated a new sample)		A unique identifier to assign parent-child, subsample, or sibling samples. This is relevant when a sample or other material was used to generate the new sample.			IGSN:DSJ0284													True				string	5.0	True			Sample ID		{text}:{text}			sample linkage	
Biosample	sample_shipped											This field is only required when completing metadata for samples being submitted to EMSL for analyses.		The total amount or size (volume (ml), mass (g) or area (m2) ) of sample sent to EMSL.			15 g|100 uL|5 mL																	string	3.0	True			EMSL		{float} {unit}			sample shipped amount	
Biosample	sample_type											This can vary from 'environmental package' if the sample is an extraction.		Type of sample being submitted			water extracted soil																	SampleTypeEnum	2.0	True			EMSL					sample type	
Biosample	saturates_pc			saturates wt%	name;measurement value	1	percent							Saturate, Aromatic, Resin and Asphaltene¬†(SARA) is an analysis method that divides¬†crude oil¬†components according to their polarizability and polarity. There are three main methods to obtain SARA results. The most popular one is known as the Iatroscan TLC-FID and is referred to as IP-143 (source: https://en.wikipedia.org/wiki/Saturate,_aromatic,_resin_and_asphaltene)								core field												TextValue						MIXS:0000131	{text};{float} {unit}			saturates wt%	
Biosample	season			season	NCIT:C94729	1								The season when sampling occurred. Any of the four periods into which the year is divided by the equinoxes and solstices. This field accepts terms listed under season (http://purl.obolibrary.org/obo/NCIT_C94729).			autumn [NCIT:C94733]					core field												TextValue						MIXS:0000829	{termLabel} {[termID]}			season	
Biosample	season_environment			seasonal environment	seasonal environment name;treatment interval and duration	m								Treatment involving an exposure to a particular season (e.g. Winter, summer, rabi, rainy etc.), treatment regimen including how many times the treatment was repeated, how long each treatment lasted, and the start and end time of the entire treatment			rainy;R2/2018-05-11T14:30/2018-05-11T19:30/P1H30M				True	core field								True				TextValue						MIXS:0001068	{text};{Rn/start_time/end_time/duration}			seasonal environment	
Biosample	season_precpt			mean seasonal precipitation	measurement value	1	millimeter					Seasons are defined as spring (March, April, May), summer (June, July, August), autumn (September, October, November) and winter (December, January, February).		The average of all seasonal precipitation values known, or an estimated equivalent value derived by such methods as regional indexes or Isohyetal maps.			0.4 inch|10.16 mm					core field										mean and average are the same thing, but it seems like bad practice to not be consistent. Changed mean to average		QuantityValue						MIXS:0000645				average seasonal precipitation	check validation & examples. always mm? so value only? Or value + unit
Biosample	season_temp			mean seasonal temperature	measurement value	1	degree Celsius							Mean seasonal temperature			18 degree Celsius					core field												QuantityValue						MIXS:0000643				mean seasonal temperature	
Biosample	season_use			seasonal use	enumeration	1								The seasons the space is occupied			Winter					core field												season_use_enum						MIXS:0000830				seasonal use	
Biosample	secondary_treatment			secondary treatment	secondary treatment type	1								The process for substantially degrading the biological content of the sewage								core field												TextValue						MIXS:0000351	{text}			secondary treatment	
Biosample	sediment_type			sediment type	enumeration	1								Information about the sediment type based on major constituents			biogenous					core field												sediment_type_enum						MIXS:0001078				sediment type	
Biosample	sequencing field	True	sequencing_field																															string											
Biosample	sewage_type			sewage type	sewage type name	1								Type of wastewater treatment plant as municipial or industrial								core field												TextValue						MIXS:0000215	{text}			sewage type	
